{
  "contract": "darwin-wrf-setups.study-requirements/1",
  "id": "synthetic:requirements",
  "revision": "1",
  "review_status": "reviewed",
  "sources": [
    {
      "id": "synthetic:source",
      "version": "1",
      "sha256": "c9e73d7c056ce843a739e08d7ff04e357b7eef67536467c5eb1ebf17f245b0d0"
    }
  ],
  "stations": [
    "synthetic:station"
  ],
  "variables": [
    "synthetic:variable"
  ],
  "operation_recipe": {
    "id": "synthetic:operation-recipe",
    "version": "1",
    "sha256": "a4121c51b9b74bf331b50609e42254097afebd47e79107b78b771a8aba078b9e"
  },
  "acceptance": {
    "criteria": [
      {
        "id": "synthetic:criterion-a",
        "description": "Test only; not an approved scientific check or threshold",
        "check": "synthetic.test-only",
        "parameters": {},
        "evidence_type": "synthetic:test-receipt"
      },
      {
        "id": "synthetic:criterion-b",
        "description": "Test only; not an approved scientific check or threshold",
        "check": "synthetic.test-only",
        "parameters": {},
        "evidence_type": "synthetic:test-receipt"
      }
    ],
    "authorized_authorities": [
      {
        "kind": "reviewer",
        "id": "synthetic:reviewer",
        "authorization": {
          "id": "synthetic:reviewer-authorization",
          "version": "1",
          "sha256": "44beb9be6083709be51762c04df8921acb1dad31dd947a99c6ec8db664cfe5ec"
        }
      },
      {
        "kind": "policy",
        "id": "synthetic:policy",
        "authorization": {
          "id": "synthetic:policy-authorization",
          "version": "1",
          "sha256": "25c980cad6173e11696dc964ead37e23624b44d8d25c0641caf5b618a271b5bd"
        }
      }
    ]
  }
}
