{
  "contract": "darwin-wrf-setups.study-requirements/1",
  "id": "synthetic-contract-test-not-scientific-approval",
  "revision": "1",
  "review_status": "draft",
  "sources": [{"id": "synthetic-source", "version": "1", "sha256": "0000000000000000000000000000000000000000000000000000000000000000"}],
  "stations": [],
  "variables": ["prcp"],
  "operation_recipe": {"id": "synthetic-select", "version": "1", "sha256": "0000000000000000000000000000000000000000000000000000000000000000"},
  "acceptance": {"criteria": [], "authorized_authorities": []}
}
